Title,Location,Company,Salary,Description
Sales Executive - Conversational AI – Artificial Intelligenc...,"New York, NY",Deloitte,None,"Are you an ambitious sales professional with an entrepreneurial spirit, relevant professional services experience, and demonstrated sales expertise and success? If so, Deloitte Services LLP is looking for a top-performing Sales Executive to focus on Artificial Intelligence enabled solutions across our commercial segments.
Experience selling professional services within the commercial marketplace, as well as experience at selling technology consulting services is ideal. However, alternative attributes to be considered for this role include, but are not limited to:

Understanding and domain expertise around AI enabled software including machine learning, speech/voice recognition, natural language processing, natural language generation, and sentiment detection
Experience working with the relevant technology ecosystem including but not limited to AWS, GCP, Azure, NICE, Twilio, kore.AI, IPsoft
Understanding of workflow and automation across IT, HR, FIN, CX and its value proposition to large or complex companies
Experience with cloud architecture and how companies use these technology platforms to achieve economic value
Experience with contact/call center process and technologies and how AI drives additional value (i.e. conversational AI for call center automation)
Experience with employee self-service and/or customer experience chatbot/virtual agent uses cases and value metrics
Understanding of key KPIs in user experience and customer engagement domains
Understanding of delivery methodology and the software development lifecycle (experience delivering services preferred)
Experience leading the pursuit process at large, complex, Fortune 500 companies (i.e. opportunity identification, value proposition and collateral creation, negotiation and contract execution)
Understanding of the services provider and technology provider alliance relationship (what motivates both sides and what a win/win looks like)
Understanding of the consulting business model – how selling at a large professional services firm is different from selling software and/or consulting at a software company

The Team

Deloitte’s Artificial Intelligence Insights & Engagement (AI I&E) practice is expanding exponentially with the growth of AI solutions and large-scale data ecosystems. The Sales Center of Excellence (COE) supports Deloitte’s businesses in uncovering, nurturing, and closing sales opportunities. Working hand-in-hand with Partners, Principals and Managing Directors, our Sales Executives focus their highly skilled efforts in securing relationships with qualified targets and decision makers to uncover opportunities, develop effective sales strategies, manage the pursuit process and act as a key advisor to the pursuit team throughout the sales process.

The Sales team supports Deloitte’s businesses with sales expertise and leadership in discovering, developing, shaping and closing sales opportunities. Working hand-in-hand with Partners, Principals, Managing Directors and Senior Managers, these sales executives focus their highly skilled efforts in securing relationships with qualified targets and decision makers to uncover opportunities, develop effective sales strategies, manage the pursuit process and act as a key advisor to the pursuit team throughout the sales process.

Work you’ll do:
The AI I&E Sales Executive is responsible for selling AI-based Deloitte solutions and consulting services to new and existing clients. As a Sales Executive you will:
o Lead business development efforts outside of core accounts for the AI I&E offering
o Work with AI I&E market offering and industry / sector leadership to identify potential clients for targeting
o Develop understanding of Deloitte Consulting’s portfolios and offerings, as well as cross-firm integrated offerings, to be conversant in our capabilities
o Understand market segmentation of target clients and potential fit with relevant business processes, technology platforms, market offerings and ecosystems
o Develop understanding of target client’s buying patterns based on industry knowledge, relationships, prior experience, etc.
o Identify target contacts and relationships within potential clients and conduct initial conversation(s) to explore opportunities
o Qualify opportunities and engage appropriate PPDs/SMs for follow up conversations as needed
Sales Support
o Run a disciplined sales pipeline including lead management, qualification, bringing established sales methods to the sales process
o Develop organized and differentiated go to market activities
o Develop overview materials to support initial meetings/conversations
o Lead preparations for formal sales meetings and orals for qualified opportunities
o Provide support to core accounts without CREs as needed for critical AI I&E opportunities
o Identify opportunities (sole source/up for bid) and bring it to the business (functional) partners, evaluate opportunity alignment with client strategy
o Identify and align appropriate firm resources to pursue, win, and manage opportunities
o Lead pursuit process, RFP responses, etc.
o Develop proposals, SOW, etc.
o Contribute to pursuit processes by leveraging relationships for insights and influence, including determining “win” themes, aligning messaging with client needs, supporting proposal/orals materials preparation, and participating in the orals session as appropriate
o Support pre-sales efforts leveraging depth of product knowledge / product demonstrations tailored to client environment
Industry Expansion and Relationship Building
o Collaborate AI I&E Alliance, Marketing and practice leads on messaging, events and eminence - both internal and external
o Identify ways the AI I&E practice can expand/enhance visibility at key events and in the market
o Participate in key industry events to build relationships and develop business opportunities
o Identify key relationships across the industry which would benefit the AI I&E practice and develop plans to cultivate those relationships
o Utilize Deloitte eminence - including thoughtware, events, trainings, conferences, and memberships – to build and enhance relationships
o Utilize available offerings to develop and participate in activities and events focused on shared values and mission, e.g., Deloitte Greenhouse events, Client Experience labs etc.
Market offering Support
o Support AI I&E market offering leadership in developing account and practice plans during the annual planning process
o Participate in AI I&E market offering leadership calls and in person meetings, and assist with planning and preparation as needed


Required Qualifications:

10+ years’ experience managing complex clients characterized by long sales cycles and significant dollar transactions
Strong sales management knowledge and/or experience
Travel up to 80% (While 80% of travel is a requirement of the role, due to COVID-19, non-essential travel has been suspended until further notice.)
Proven consistent track record of delivering multimillion dollar revenue per annum
Knowledge and understanding of large scale implementations, especially cloud apps
Ability to develop and secure relationships with buyers, decision makers, influencers and other referral sources across a variety of industries
Experience in relationship building that increases account penetration and leads to increased revenue opportunities with existing clients
Ability to develop and utilize pre-existing network of clients or contacts in the marketplace
Lead or support practice sales management activities
Experience managing internal sales activities to ensure consistent approach to marketplace across geographies and industry groups
Experienced with a complex pursuit process, proposal development and oral presentations that win new business
Ability to work in a multi-layered matrix organization serving many leaders
Understands complexity of natural language and conversational experiences
Must be legally authorized to work in the United States without the need for employer sponsorship, now or at any time in the future
Undergraduate degree
Preferred:
Expertise in 2+ domain preferred (e.g., Customer & Marketing, Finance, M&A, Operations, Pricing, Risk, Supply Chain, Workforce, etc.)
Basic understanding of SDLC (software development lifecycle) and agile delivery methodologies
Experience in Technology, Media, Telecommunications, Consumer (especially transportation) and Financial Services & Insurance a plus
Advanced degree(s) preferred
Success in working closely with service line leaders, partners, practitioners and other SEs to develop strategies and tactics that drive targeting programs and win business
How you’ll grow

At Deloitte, our professional development plan focuses on helping people at every level of their career to identify and use their strengths to do their best work every day. From entry-level employees to senior leaders, we believe there’s always room to learn. We offer opportunities to help sharpen skills in addition to hands-on experience in the global, fast-changing business world. From on-the-job learning experiences to formal development programs, our professionals have a variety of opportunities to continue to grow throughout their career.

Benefits

At Deloitte, we know that great people make a great organization. We value our people and offer employees a broad range of benefits. Learn more about what working at Deloitte can mean for you.
Deloitte’s culture

Our positive and supportive culture encourages our people to do their best work every day. We celebrate individuals by recognizing their uniqueness and offering them the flexibility to make daily choices that can help them to be healthy, centered, confident, and aware. We offer well-being programs and are continuously looking for new ways to maintain a culture where our people excel and lead healthy, happy lives. Learn more about Life at Deloitte.

Corporate citizenship

Deloitte is led by a purpose: to make an impact that matters. This purpose defines who we are and extends to relationships with our clients, our people and our communities. We believe that business has the power to inspire and transform. We focus on education, giving, skill-based volunteerism, and leadership to help drive positive social impact in our communities. Learn more about Deloitte’s impact on the world.

Recruiter tips

We want job seekers exploring opportunities at Deloitte to feel prepared and confident. To help you with your interview, we suggest that you do your research: know some background about the organization and the business area you’re applying to. Check out recruiting tips from Deloitte professionals."
"Senior Software Engineer, Data","New York, NY",CB Insights,None,"Develop a state-of-the-art product. Make sense of the future. Use data to grow your business.
If you are a coding fanatic and passionate about programming, we want you to help us make a huge impact. Our clients love our product and are thirsty for more!
At CB Insights we build products that help clients make sense of the future and drive their businesses forward using data. Our system retrieves large amounts of structured and unstructured data and uses scientific methods to extract knowledge and insights from that data. We present those analytics through a sophisticated, dynamic user interface which enables our clients to find answers to their most important questions.
Your main tasks:
Senior Data Engineer will be the main engineering resource within our data science team. Reporting to the R&D Team Lead, you will work alongside data scientists on cutting-edge problems. The goal is to build efficient and reusable data and machine learning pipelines to enable rapid R&D work, make it easy to productionize the research, quickly adopt new data sources, and maintain the best software engineering practices. The data engineer will collaborate with software engineers from other teams and influence the company's engineering strategy.

You will join a small and very motivated team doing interesting and unique work in NLP and knowledge discovery. You'll get access to rich and interesting data and a chance to build cutting-edge data processing pipelines. Here is your chance to be all you can be. This position is critical to scaling the data science team. You'll be responsible for enabling data science in a truly data-centric company.

What you bring to the table:
BS in Computer Science or similar; advanced degrees also acceptable
4+ years professional experience in Python. Familiarity with Go is a plus
Relational database proficiency (e.g. Redshift, MySQL, Aurora)
Experience using Spark, Sqoop, AWS services (Spectrum, Glue) and other related tools in the big data ecosystem
Knowledgeable of data modeling, data storage techniques, data warehousing and general data architecture
Experience with engineering data pipelines to capture, store and process unstructured data
Proficiency developing in a Mac/Linux environment

The Perks:
Amazing culture: Happy, Helpful, Humble, Hungry. Learn more here
A newsletter that 600k people follow: Sign up here.
Be Healthy: Health with HSA and FSA options, dental, and vision insurance along with unlimited/take what you need sick day policy
Plan for the future: 401k with up to 4% match
Continued Learning: $1,000 yearly continuing education stipend
Rest and Relax: Competitive vacation and holiday plans
Refuel: Daily lunch stipend, unlimited snacks/coffee
We are dedicated to adding new perspectives to the team and encourage everyone to apply if your experience is close to what we are looking for.
Equal Opportunity Employer: CB Insights is committed to creating a diverse environment and is proud to be an equal opportunity employer. All qualified applicants will receive consideration for employment without regard to race, color, religion, gender, gender identity or expression, sexual orientation, national origin, genetics, disability, age, or veteran status.
If you know someone who'd be perfect for the role,
submit here and you'll be eligible for $5,000!

#LI-FR1"
"Senior Data Scientist, Data, Models & Decisions","New York, NY",LivePerson,None,"LivePerson is a transformational force in how Brands and Consumers communicate. With over 18,000 customers including Citi, HSBC, Disney, Verizon, and Home Depot, we are on a mission to make life easier for people and brands everywhere through trusted conversational AI. We believe in a future where conversations are the norm for getting your intentions fulfilled - whatever they are.
We are an innovative, intent-driven company that believes in building the future and we are looking for growth minded, unconventional thinkers to join the team.
You will thrive here if:
You can operate in a fast paced, dynamic environment
You nerd out about AI, how it can be applied, or how you can learn more about it (don't worry we'll help)
You believe data-led decision making is the norm
You see feedback or failure as motivation to learn and to grow
You relate to our core principles and want to work with experts in their respective fields
Reporting to the Director of Data, Models, and Decisions (DMD), the successful candidate has an opportunity to join an innovative data science and engineering team that's operationalizing data across the organization. We see model-driven processes and workflows as a means to reduce uncertainty, reveal opportunity, and generate operational leverage that collectively create a new dimension of competitive advantage and lay the foundation for new revenue streams.
In this role you will:
Apply cutting-edge machine learning methods to derive value from data across the company, including one of the world's largest goal-oriented conversational data sets
Solve challenging unsupervised and supervised learning problems that help redefine the Company's strategy and execution
Propose and execute research efforts integrated with production systems
Design and build a modern, flexible predictive analytics platform
Develop measurement strategy, control methodology, and experimental design
Simplify stakeholder access to novel insights and key performance indicators through conversational AI
Your qualifications are:
5+ years of experience deploying machine learning models in a production environment
Masters or PhD in Computational Linguistics, Computer Science, Statistics, Physics, Mathematics, or another quantitative field
Ability to write Python code that is efficient and clean
Experience with distributed computing frameworks such as Spark and Hadoop
Experience with scripting languages working in a Linux environment
Ability to work closely with teammates in a highly collaborative environment and simultaneously be a self-starter with strong individual contributions
Experience with Python packages for data science and machine learning, including pandas and scikit-learn
Experience modeling to production and monitoring performance pre- and post-launch
Ability to collaborate with stakeholders and quantify ROI to help ensure model adoption
Why you'll love working here:
LivePerson was named to FastCompany's World's most innovative companies of 2020 list for the Artificial Intelligence category. We offer amazing colleagues along with opportunities to push your own limits to grow. We embrace invention and experimentation. You'll have great benefits plus flexible time off and free lunch on Fridays. Most importantly, you'll have an ability to make an impact at work and at brands across the globe as we build the future with trusted Conversational AI together.
At LivePerson, people from diverse backgrounds come together to do their best work and be their authentic selves. We are proud to be an equal opportunity employer.
All qualified applicants will receive consideration for employment without regard to age, ancestry, color, family or medical care leave, gender identity or expression, genetic information, marital status, medical condition, national origin, physical or mental disability, protected veteran status, race, religion, sex (including pregnancy), sexual orientation, or any other characteristic protected by applicable laws, regulations and ordinances. We also consider qualified applicants regardless of criminal histories, consistent with legal requirements."
AI Research Scientist,"New York, NY",Bloomberg,None,"News and social media move financial markets. Bloomberg is one of the largest producers of news in the world and we ingest millions of news stories every day from over 70,000 external news feeds and social media such as Twitter. This data keeps our clients informed, and our team's insights help make sense of it for our customers.

Who are we? Bloomberg's Artificial Intelligence (AI) group: researchers and engineers who have a passion for solving complex problems. Our charter: to extract and identify relevant, meaningful, tradable, and actionable information (such as pricings, earnings, recommendations and major events) from data (including news, web, social media, and structured data) in real-time. Since our customers rely on this information to make swift financial decisions, we guarantee precision, accuracy, and latency numbers beyond most academic and industry standards.

We aren't just building customer-facing products, as the infrastructure and algorithms we develop are themselves used across the company. We also publish papers, attend conferences, organize workshops, and contribute back to the larger data science community whenever we can (see https://www.techatbloomberg.com/nlp/ and https://bloomberg.com/company/d4gx/).

Who are you? A research scientist and engineer who wants to work in the areas of machine learning, natural language processing, information extraction, reinforcement learning, graphical models, recommender systems, and/or knowledge graphs. You want to join a close-knit group and make a big impact.

We'll trust you to:
Work with others in the AI group and the company on production systems and applications

Publish research findings in leading academic venues and represent Bloomberg at industry conferences
Write, test and maintain production-quality code
Design, experiment, and evaluate algorithms, and models

You'll need to have:
5+ years of experience in AI, NLP, ML, Optimization, or related fields

5+ years of experience programming in C++, Python or Java
A master’s degree (PhD preferred) with industrial experience

We'd love to see:
A quantitative background (Probability, Statistics, Linear Algebra, etc.)

Experience with distributed computational frameworks (YARN, Spark, Hadoop, Kubernetes, Docker)
3+ publications in top-tier conferences or journals (such as ACL, AAAI, SIGIR, KDD, EMNLP, ICML, NeurIPS or equivalent)

If this sounds like you, apply!
In addition, do check out our blog, TechAtBloomberg.com/NLP, to learn more about our publications and projects in data science.
Bloomberg is an equal opportunities employer, and we value diversity at our company. We do not discriminate on the basis of race, religion, color, national origin, gender, sexual orientation, age, marital status, veteran status, or disability status."
Senior Developer,"New York, NY",Sensentia,None,"Location:

Remote with ability to work in US time zones – excellent Latin American and Canadian candidates are encouraged to apply; OR

New York City.

Who we are

Sensentia is an innovative technology company that uses artificial intelligence to simplify access to health insurance information, allowing anyone to make better and more appropriate decisions about their healthcare. Through a new genre of natural-language self-service tools, patients, care providers and payers can have their health care insurance questions answered and receive guidance immediately, anywhere, anytime and on any device. Sensentia’s mission is to empower people to make better health decisions and drive down the cost of healthcare. The company is headquartered in San Francisco, and has offices in New York and Denver.

We are currently working with Fortune 100 and 500 health insurance companies and expanding our technical, linguistic, and operations teams. For more information, visit www.sensentia.com.

Job description

You will take a lead in developing the company’s software and systems, ensuring that our products meet design requirements, and deliver a consistent positive experience for users. You will be part of a team of world-class engineers and developers, collaborating with the product managers, as well as applying the company’s product vision and maintaining compliance with quality standards. You should excel in working with large-scale applications and frameworks and have outstanding communication and leadership skills. The ideal candidate is a self-motivated multi-tasker and demonstrated team-player.

Key Responsibilities

Reporting to the VP of Architecture & Engineering, key deliverables will include:

1. Creating high-performance APIs using AWS serverless model (C#).

2. Creating scalable and customizable pipelines to extract, transform, and understand (NLU) client data (C#, Python, SQL).

3. Using cloud technology to achieve the best possible solutions for our clients.

4. Creating tools for the Knowledge Modeling group (C#, SQL).

5. Embodying the company’s culture and core values:

Embrace the company culture by adopting a metrics-driven but collaborative approach that prioritizes meeting the strategic goals of the company.
Champion a company-wide culture of superior software development, aligning with the overall strategy of Sensentia.
Demonstrate professionalism as well as a collaborative working style that maintains a culture of ownership, accountability, and teamwork. Take proactive steps to optimize team communication, collaboration, and chemistry.
Bring a mindset of personal/professional development, continuous learning, and excellence to the virtual working environment each day.
Be an active thought partner to the CEO and senior leadership team.
Be a self-starter and embody initiative, respect for colleagues, resilience, and flexibility ongoingly.

Minimum requirements

1. A Bachelor’s degree in Computer Science, Software Engineering or similar.

2. A minimum of 5 years’ software development experience.

3. Expert proficiency in C#, SQL and Python (ability to write scripts in Python).

4. Strong proficiency in MS Office interoperation (including reading and writing MS Officer files such as Excel files).

5. Strong proficiency with file formats, such a json, xml, tsv, csv, pdf.

6. Demonstrable ability to create algorithms that turn unstructured data into structured data.

7. Understanding of Natural Language Processing toolkits.

8. Self-motivated self-starter with a performance orientation and commitment to delivering results.

9. Willingness to think out of the box, innovate, and work with new and different artificial intelligence paradigms. Forward thinking and passionate about developing highly innovative breakthrough technologies, and the endurance and resilience to make innovation happen.

10. A desire to improve the healthcare system.

11. Ability to work in highly diverse teams, but also an ability to work independently when required.

12. Excellent verbal and written communication skills. Fluent written and spoken English.

Nice to haves

1. Experience providing IT support for cloud based systems.

2. Passion for start-ups.

What we offer:

1. Competitive base salary.

2. Benefits:

Medical (80% of premium covered by Sensentia, including family);
Dental/vision (80% of premium covered by Sensentia);
401k with up to 4% company contribution;
Discretionary vacation policy;
Worker's comp."
