Title,Location,Company,Salary,Description
Behavioral Data Intern - Ipsos Behavioral Data Group,"New York, NY",Ipsos North America,None,"At Ipsos, we make market research work. We know numbers. We understand people. And we succeed in delivering results. That’s why so many of the world’s leading brands and organizations look to us for their research needs.

Have you always been curious about what influences people and the decisions they make? Do you love a good mystery? Feel compelled to seek out the true meaning of things?

Would you like to work with a team of passionate problem-solvers dedicated to bringing research insights and compelling data to life?

If all this sounds good so far, you could be just the person we’re looking for.

About our team

We are the Ipsos Behavioral Data Group. We’re a small but diverse growing team of data nerds specialized in understanding the pairing of digital behaviors with consumer mindsets. Over the past two years we have evolved our vast collection of custom project work into a standardized suite of business solutions. For 2019 we continue to expand the list of clients and portfolio of capabilities. It’s an exciting time to join us. We have a voracious appetite for learning and a geeky sense of humor. This team doesn’t shy away from challenges and we excel at tackling some of the toughest problems in market research today.

We work with Fortune 500 partners across all industries worldwide to bring new data streams into our business, combining them with advanced analytical and modeling techniques to develop a richer understanding of our clients’ customers.

Behavioral Data Intern

Position Summary

We’re looking for a dedicated and motivated individual proficient in SQL and data analysis to work in an internship role for 10 to 12 weeks. Our projects center us at the intersection of survey responses and internet consumption. As a data analyst intern, you will help us evaluate new and existing data partnerships by exploring the quality and effectiveness of mobile and desktop data from a variety of sources. You will diagnose potential issues and conduct thorough documentation and audit checks. You will also play a hands-on role developing new business capabilities and efficiency improvements. Self-motivation and strong communication skills are both must haves.

Key Responsibilities

Primary task is to audit and evaluate multiple metered panel companies we partner with.
Live real-world testing of latest versions of the metered tracking software.
Diary management of actions taken. Importing and transforming digital data from the partner.
Analyzing data in SQL to check for completeness and quality.
Develop prototype reports and sample insights that come from new sources.

Secondary task is to audit and evaluate semantic classification technology form data vendors.
Clean,parse, and sample large volumes of digital text and URL data.
Analyze and evaluate success rate for each partner, compared to existing classification system.
Build an API infrastructure to retrieve data via automation.
Develop refined process of semantic classification of natural language or unstructured data.
Toward the later weeks of the internship, tasks will be extended to include client project work.
Compile and combine data from various sources into standardized outputs for analysis.
Design, format, and perform quality checks of data handoffs to internal teams.
Analyze results for key project learnings and present analysis to internal teams.

Must Have Qualifications

Candidate for bachelor’s degree in a quantitative subject. (Math, Stats, Computer Science, Economics, Engineering)
Ability to think creatively and solve complex problems.
Experience with using SQL, programming languages, or statistics for analytical techniques.
Good knowledge of foundational data warehousing concepts, best practices, and procedures.
Strong verbal and written communication skills.
Strong analytical and troubleshooting skills.
Strong initiative and dedicated work ethic.

Favorable Skills and Experience

Prior internship experience with market research studies or client work.
Experience with hands-on coding from scratch. (Python, Perl, C, Java, Julia, Scala)
Experience with predictive modeling and machine learning. (Neural Networks, Clustering, Segmentation, etc.)
Experience with statistical or scientific computational software like SPSS, SAS, R, or Matlab.
Experience working effectively with very large datasets.

Additional Information

Sound like the right place for you? Share our passion. Share our success. And join us in being an #IpsosGameChanger.

Please submit a detailed resume that demonstrates you have the experience and abilities we are seeking online by clicking the ""Apply"" button below. We thank all applicants; however only those short-listed for an interview will be contacted.

Required Skills

Required Experience"
Senior Machine Learning Engineer,"New York, NY",Ayata,None,"Ayata is developing its Prescriptive Analytics® software by integrating the latest Artificial Intelligence (AI) and related technologies. We are looking for people with multi-disciplinary skills, especially in software design and artificial intelligence, who can write solid clean code and who are excited about applying those skills to build industrial strength software. You’ll be part of a multi-disciplinary team working to design, develop and implement our unique software. Your contributions will directly impact the success of the company.
Job Responsibilities and Duties
Ayata is looking for experienced Sr. Machine Learning Engineer who will develop machine learning models for business applications and build cloud-based AI software for predictive analytics business solutions. This candidate will bring considerable natural language processing knowledge and experience to the team.
Responsibilities:
Lead model development, providing methodology, strategy, ideas, architect, and solutions for real-word, industrial-scale and mission-critical business operations
Develop AI/ML models for business applications
Build and integrate models into a full-functioning AI business software
Interact with business clients, understand business requirements, propose AI software solutions to meet the business requirements, deliver and present AI software to clients
Understand the data set used for the modeling, prepare and preprocess data sets, train and test models and perform model feature engineering
Document data dictionary, data understanding, modeling strategy and approaches, and build company’s knowledge base of data and models
Communicate effectively with team members, management, and clients
Requirements
Must have at least 1+ year NLP experience in a professional or research capacity
Must have NLP Expertise and practical knowledge with preprocessing (Spacy or NLTK), Topic modeling (Gensim), POS-tagging, word embedding. Spacy, nltk, genism are the related software
Proven ability to work with large structured and unstructured datasets
Demonstrable, hands-on experience in developing advanced analytics algorithms/models, including time series forecasting, machine learning and deep learning, image processing, natural language processing, and speech recognition
Excellent hands-on code development skills in Python
Good Knowledge of Machine Learning frameworks and packages, including Keras, TensorFlow, MXnet, Scikit-Learn and cloud technology (Amazon, Azure, etc.)
Experiences in Machine Learning, Deep Learning, Computer Vision, and Natural Language Processing
PhD degree in Mathematics, Statistics, Computer Science, or related disciplines
At least 3 years of Artificial Intelligence
At least 3 years of Machine Learning
Background in Property and Casualty Insurance a big plus!
You must be able to work out of our Houston office
Additional Qualifications
Parallel and distributed processing experience is a plus
Expertise in data Extraction Transformation and Loading (ETL) is a strong plus (Spark, Hadoop, SQL) in big data environments.
Domain knowledge in financial and insurance industries is a big plus
The candidate must be able to work out of the Houston Texas office but remote work will be considered for extremely strong candidate
Relocation reimbursement is available for the right candidate
You must have a PHD to be considered for this position.
Benefits
Compensation package (base salary + performance bonus + stock options) commensurate with experience.
Industry (tech/software industry) standard benefits package - medical, dental, vision, 401(k) plan, work-from-home (if applicable), flexible holidays, and more."
Senior DevOps Engineer,"New York, NY",Code and Theory,None,"DevOps Engineers at Code & Theory support the engineering team globally. They work across different platforms and technical stacks, and make sure that each team has the right tools at their disposal to be as efficient as possible. They streamline the on boarding of new developers and development process by working side by side with the technical director on:
Normalized architectures that take into account performance, maintainability, while respecting the best practices.
Standardized and pre-configured dev and QA environments relying on templates
Continuous Integration / Continuous Deployment, etc.
You will also be responsible for optimizing our internal tools, from the way we are managing our cloud environments, to way our internal projects are set up and maintained.
Finally, you'll be supporting active and upcoming projects for which we develop new experiences and have to deliver new types of system architecture. Whether it's for in-store experiences, AR/VR projects, AI tools, signage projects, we need our DevOps engineers to ideate and experiment with the development teams to come up with the best solutions.
In your first few months, you can expect to:
Audit our current cloud infrastructure and recommend paths for improvement
Review existing clients' projects/architecture/infrastructure to support the respective development teams
Analyze our current build processes, especially around Technical Architecture Definition and Sprint 0, to identify how this process can be optimized.
In your first year, you will:
Develop a skill set across all the technical stacks that Code & Theory is using: CMS, Ecommerce, AI/ML/NLP, AR/VR, experiential, etc.
Interact with Technical Directors very early in the delivery process (as early as the definition phase)
Rollout the improvements that have been identified (potential topics: CI/CD, Atlassian, AWS/Azure, Server provisioning, etc.)
Mentor Technical Directors and other DevOps engineers to expand our knowledge base in the field and establish best practices.
To succeed in this role you should have:
5-7 years of work experience. An understanding of typical agency processes is beneficial but not required
Extensive sysadmin and devops experience
Designing and operating highly available software in large distributed and virtual environments.
Automation should be in your DNA
Working on continuous deployments in a rapid startup or agency environment
Robust capabilities in Linux, Unix, MacOX and Windows operating systems
Deep understanding of complex network topologies, cloud/laas environment (AWS, Azure), virtualization software (VMWare) and build systems (Jenkins, Maven, Ant).
Tools including: orchestration (Kubernetes), configuration management (Ansible, Chef), containerization (Vagrant, Docker) and monitoring/alert (New Relic, Nagios)
Experience setting up platforms and processes in a multi-project, multi-client environment
Experience integrating environments for both web projects (Drupal, AEM, Sitecore), as well as mobile or interactive projects
ABOUT US:
Code and Theory is a digital-first strategic and creative agency that designs products, content, and campaigns across physical and digital environments. Founded in 2001 and operating out of offices in New York, San Francisco, London, Atlanta, and Manila, we believe a mix of technology and creativity can solve complex business problems to drive forward innovative change.
From helping to redefining the publishing landscape through our work with media companies such as NBC News, WWE, Bloomberg, The BBC, The Outline, Vogue, and The Guardian, to creating award-winning marketing programs for brands such as Maybelline New York, Victoria's Secret, and Burger King, to developing unique customer experiences for NYLife, Quest Diagnostics, Citibank, Dignity Health, Reebok and Colgate to designing physical products for companies like Brown-Forman, Hearst, and Comcast, Code and Theory is a creative agency built for the entire ecosystem.
At Code and Theory, we strive to only be limited by our own ambition and creativity. We believe in pushing beyond the easy and obvious answers in order to deliver the solutions that are right for our clients, their businesses, and their users.
BENEFITS:
In addition to working with the smart and passionate people that make up the Code and Theory family, you also get the perks. There's the usual - 401k, excellent health, dental and vision coverage, life insurance, flexible spending, pre tax commuter benefits and long- and short-term disability. Code and Theory has a newly improved flexible vacation policy that does not put a defined limit on the amount of paid time off an employee takes in a year as long as they are responsible and accountable to their work. This policy is based on mutual trust between Code and Theory and our employees. Then there are the extras, some random, mostly awesome – bagel Mondays, stocked candy jar and exceptional Stumptown coffee and cold brew, monthly massages, and team outings.
Code and Theory is an equal opportunity employer, and we value diversity at our company. We don't discriminate on the basis of race, religion, color, national origin, gender, sexual orientation, age, marital status, veteran status or disability status."
IT Support Engineer,"New York, NY 10019 (Midtown area)",Viant,None,"Viant’s culture is a unique combination of strong leadership, ambition, collaboration, and fun, with incredible growth opportunities for our employees! We offer a fast-paced work environment, with a strong focus on employee engagement, recognition, and development. With a commitment to innovation from the top down, Viant continues to remain ahead of the curve in the rapidly changing ad tech marketplace.

About the Role:

The IT Support Engineer is a critical component of the Corporate IT team. As a member of the team, responsibilities will include answering email and phone calls detailing issues reported by clients regarding specific application and/or hardware related requests.

Responsibilities:
Isolate problems, determine cause and take action steps necessary to resolve the problem.
Verify with customer the effectiveness of corrective actions to ensure problem is resolved.
Provide escalation support for other members of the Corporate IT Team.
Work directly with other IT teams to understand end user needs for new applications and systems.
Identify and communicate common end user computing problems.
Assist project teams with hardware and software rollouts as needed.
Stay informed about specific application and system changes that are being made while working with appropriate application and technology teams.
Route accurate and detailed descriptions of unresolved problems to the appropriate support personnel.
Assist corporate office computer users through technical support as needed.
Coordinate with customer and vendor in the servicing of malfunctioning hardware.
Maintain record of work performed and prepare activity report as requested.
Establish and maintain effective working relationships with all IT staff, vendors, customers and management.
Setup new hires
Provide support for tradeshows, conferences and meetings
Assist with moves and deployment of IT equipment
Qualifications:
Excellent command of the English language (written and verbal)
Solid understanding of corporate desktop-computing environment including hardware, software, telecommunications, operating systems and utilities.
Ability to present ideas in user-friendly language to both technical and non-technical end-users.
Ability to teach users how to use software.
Awesome customer service skills
Strong organizational skills and detail-oriented work ethic
Associate's degree or equivalent related experience required. Certifications: MCP or MCSE, CompTIA A+
3+ years of related technical support experience.
Experience in supporting local and remote offices via remote connection.
Microsoft Client Products: Windows 10, Office 2016 (Mac/PC),
Microsoft Management Products: MS Server 2008r2 - 2019, Active Directory, Office 365, Microsoft Exchange, Windows Deployment Services
Apple Products – MacOS, iOS
Working knowledge of the following products is a plus: Google G-Suite, Slack, RingCentral, Okta, Jamf, Atlassian Suite, Teamviewer, Airtame, Sentinel One, Dropbox
Benefits:
Competitive Salary and Bonuses
Paid benefits for the employees:
Medical, Dental, Vision, LTD, Life insurance/AD&D
Paid parental leave
401k
Summer “Work from Anywhere” Fridays
Health and Wellness programs
Employee discounts – e.g. gym memberships, wireless plans, entertainment tickets
Fully stocked kitchen
Casual Office Atmosphere
Commuter Benefits Program
Ongoing Education & Training
Company Sponsored Events & Team Building Experiences
About Viant:

Viant is transforming the world of omnichannel, programmatic media buying and advanced data analytics with a wide range of technologies leveraging artificial intelligence and machine learning to advance digital advertising effectiveness.
Viant designs and develops cloud-based software systems for automated routine analyses to identify hidden insights and high-value opportunities. We capture and analyze data about demand patterns, product preferences, and content consumption behaviors to improve customer retention and loyalty. Viant is continually optimizing how we measure that experience to determine how and where our clients should advertise and sell their products. Viant aims at uncovering revenue opportunities hidden in customer data and recommends where clients should focus marketing experiments to provide high-impact business breakthroughs faster. Viant’s vision is to improve advertising effectiveness by driving real business outcomes while transforming enterprise data into actionable natural language insights for business leaders.
In 2017, Viant acquired Adelphic Inc., a programmatic demand side platform company. Adelphic provides an omnichannel programmatic software solution for agencies, brands and other large media buyers to make meaningful engagements with consumers across today’s fragmented media market. For more information visit us at www.viantinc.com.

#LI-NS1"
Data Science Senior Consultant - New York and Chicago,"New York, NY 10003 (Flatiron District area)",Capgemini,None,"Data Science Senior Consultant - New York and Chicago
048043
Senior Consultant - Artificial Intelligence - New York

The AI & Analytics practice group at Capgemini is expanding its footprint… rapidly. As part of the fastest growing digital practice within Capgemini, we work with the latest advanced analytics, machine learning, and big data technologies to extract meaning and value from data in a number of different industries, including Media & Entertainment, High Tech, Automotive, Consumer Products & Retail, Industrial Products, Manufacturing, Telecom, Aerospace & Defense, and Energy & Utilities.

The AI & Analytics group is the fastest growing digital practice at Capgemini demanding agile innovation. As part of the AI & Analytics group, you will work in a collaborative environment with internal and client resources to understand key business goals, build solutions, and present findings to client executives while solving real-world problems. If you are passionate about solving problems in the realm of cognitive computing, big data, and machine learning while utilizing business acumen, statistical understanding, and technical know-how, the AI & Analytics practice group at Capgemini is the best place to grow your career

Role & Responsibilities:

Work in a collaborative environment with global teams to drive client engagements in a broad range of industries to design and build scalable AI and Machine Learning solutions to solve business problems and create value by leveraging client data
Work with team to quickly understand client needs, develop solutions, and collaboratively present findings to client executives
Collaborate with team to provide data-driven recommendations and solutions to clients by clearly articulating complex technical concepts through generation and delivery of presentations
Analyze and model both structured and unstructured data to generate value
Use industry expertise and data science experience to uncover new opportunities with clients’ data
Perform EDA and feature engineering to both inform the development of statistical models and generate improve model performance and flexibility
Design and build scalable machine learning models to meet the needs of given client engagement
Assist with the mentorship and development of consultants
Assist in growing data science practice by meeting business goals through client prospecting, responding to proposals, identifying and closing opportunities within identified client accounts

Qualifications:

3-5 years professional work experience as a data scientist or on advanced analytics/statistics projects
Master’s degree or PhD in Computer Science, Statistics, Economics, Mathematics, or other closely related field
Excellent team-oriented and interpersonal skills, with a strong interest for consulting
Outstanding communication skills with the ability to clearly articulate findings and present solutions to business partners

Preferred Qualifications:

Experience with Deep Learning methods in NLP & computer vision, sentiment analysis, topic modeling and graph theory and databases
Experience with common data science tools such as Python, R, Pytorch, TensorFlow, Keras, or Neo4j, and a good understanding of modelling platforms (Azure AutoML, SageMaker, DataBricks, DataRobot and H2O.ai)
Experience working with big data distributed programming languages, and ecosystems: Spark, Hadoop, MapReduce, Pig, Kafka
Familiarity with Cloud-based environments such as AWS (S3/EC2), Azure, Google Cloud
Knowledge of other coding languages such as Java, Matlab, SAS, C++
Experience with building and deploying predictive and prescriptive analytics models

Capgemini is an Equal Opportunity Employer encouraging diversity in the workplace. All qualified applicants will receive consideration for employment without regard to race, national origin, gender identity/expression, age, religion, disability, sexual orientation, genetics, veteran status, marital status or any other characteristic protected by law.
This is a general description of the Duties, Responsibilities and Qualifications required for this position. Physical, mental, sensory or environmental demands may be referenced in an attempt to communicate the manner in which this position traditionally is performed. Whenever necessary to provide individuals with disabilities an equal employment opportunity, Capgemini will consider reasonable accommodations that might involve varying job requirements and/or changing the way this job is performed, provided that such accommodations do not pose an undue hardship.

Click the following link for more information on your rights as an Applicant - http://www.capgemini.com/resources/equal-employment-opportunity-is-the-law


About Capgemini

A global leader in consulting, technology services and digital transformation, Capgemini is at the forefront of innovation to address the entire breadth of clients’ opportunities in the evolving world of cloud, digital and platforms. Building on its strong 50 year heritage and deep industry-specific expertise, Capgemini enables organizations to realize their business ambitions through an array of services from strategy to operations. Capgemini is driven by the conviction that the business value of technology comes from and through people. It is a multicultural company of 200,000 team members in more than 40 countries. The Group reported 2018 global revenues of EUR 13.2 billion.

Visit us at www.capgemini.com. People matter, results count.

Job Programmer/Analyst
Schedule Full-time
Primary Location US-NY-New York
Other Locations US-IL-Chicago
Organization I&D"
