Title,Location,Company,Salary,Description
Data Scientist,"New York, NY",Amazon.com Services LLC,None,"Bachelor's Degree
3+ years of experience with data scripting languages (e.g SQL, Python, R etc.) or statistical/mathematical software (e.g. R, SAS, or Matlab)
2 years working as a Data Scientist
Statistics, Applied Mathematics, Operation Research, Economics or a related quantitative bachelors' or masters' degree.
Experience articulating business questions and using quantitative techniques to arrive at a solution using available data

At Amazon we continually look for opportunities to invent on behalf of our customers, helping them to find and discover virtually anything they want to buy online. To this end, we are building a range of advertising products that enhance the customer experience and are integrated with our core eCommerce platform. We have developed products that leverage Amazon’s strength as a world class eCommerce platform and have integrated advertising into the shopping experience from first discovery to purchase.

The future of our business is compelling and we are focused on building a robust, innovative business, enabling advertisers of all sizes. Our products range from eCommerce ads that integrate the power of familiar shopping features to visually stunning Kindle screensavers. We can reach customers on Amazon properties, both web and mobile, and across our ad platform. A strategic part of our charter is to build a portfolio of self-service, cost-per-click advertising programs to enable both large and small advertisers to engage with customers in relevant ways.
As a successful data scientist on the Amazon Advertising team, you need to understand performance advertising domain knowledge and the meanings of data. You will expose and measure current Amazon Advertising performance. You will identify specific and actionable opportunities to solve existing business problems, and collaborate with engineering, research, and business teams for future innovation. You need to be a sophisticated user of advanced quantitative techniques for answering specific business questions, and an expert at synthesizing and communicating insights and recommendations to audiences of varying levels of technical sophistication.

Major responsibilities include:
Translate / Interpret
Translate business questions and concerns into specific quantitative questions that can be answered with available data using sound methodologies. In cases where questions cannot be answered with available data, work with engineers to produce the required data.
Measure/Quantify/Expand
Retrieve, synthesize, and present critical data in a format that is immediately useful to answering specific questions or improving system performance.
Analyze historical data to identify trends and support decision making.
Improve upon existing methodologies by developing new data sources, testing model enhancements, and fine-tuning model parameters.
Provide requirements to develop analytic capabilities, platforms, and pipelines.
Apply statistical or machine learning knowledge to specific business problems and data.
Explore/Enlighten
Formalize assumptions, create statistical definition of the outlier, and develop methods to systematically identify these outliers. Work out why such examples are outliers and define if any actions needed.
Given anecdotes about anomalies or generate automatic scripts to define anomalies, deep dive to explain why they happen, and identify fixes.
Make Decisions or Recommendations
Build decision-making models and propose solution for the business problem you defined
Conduct written and verbal presentation to share insights and recommendations to audiences of varying levels of technical sophistication.

Depth and breadth in quantitative knowledge. Excellent quantitative modeling, statistical analysis skills and problem-solving skills. Sophisticated user of statistical tools.
Experience processing, filtering, and presenting large quantities (Millions to Billions of rows) of data
Combination of deep technical skills and business savvy enough to interface with all levels and disciplines within our customer’s organization
Demonstrable track record of dealing well with ambiguity, prioritizing needs, and delivering results in a dynamic environment
Excellent verbal and written communication skills with the ability to effectively advocate technical solutions to research scientists, engineering teams and business audiences
Ability to develop experimental and analytic plans for data modeling processes, use of strong baselines, ability to accurately determine cause and effect relations
Demonstrable track record of dealing well with ambiguity, prioritizing needs, and delivering results in a dynamic environment
Experience in digital advertising is a plus
Experience with Natural Language Processing (NLP)

Amazon is committed to a diverse and inclusive workplace. Amazon is an equal opportunity employer and does not discriminate on the basis of race, national origin, gender, gender identity, sexual orientation, protected veteran status, disability, age, or other legally protected status. For individuals with disabilities who would like to request an accommodation, please visit https://www.amazon.jobs/en/disability/us."
Sr Data Engineer - Graph Database,"New York, NY 10162 (Upper East Side area)","Jefferies & Company, Inc.",None,"Description

CRM & Analytics Team Overview
The CRM & Analytics team is a highly strategic and cross-functional team responsible for leading the firm’s global digitalization effort. This initiative, spanning all client-facing business units and corporate functions, will drive innovation and strategic change through technology, data science, and deep analytics. The team partners with key business leaders and industry experts to build transformational technology to drive revenue, maximize efficiency, and optimize the allocation of resources. The CRM & Analytics team is at the forefront of Jefferies’ cloud initiative, leveraging best-in-class cloud-based technologies to replace legacy on-premises solutions to provide intelligent trend insights, actionable opportunities, decision support, and transparency into all client and business-related activities.


Graph ML Data Engineer
The CRM & Analytics Team at Jefferies is looking for a Graph ML Data Engineer to join the graph team. This role is for an experienced data engineer familiar with working in a machine learning environment. This role reports to the head of knowledge engineering.
Over the past three years, our team has developed a large-scale knowledge graph powering several applications in the firm. As the graph was growing, we have partially switched to distributed processing of the many datasets that feeds it. We are now looking to 1) improve our graph processing jobs to improve their speed and setting best engineering practices and 2) make use of the richness of the graph to provide business insights using exploratory and predictive techniques.

Qualifications

You are:
an accomplished software engineer able to ensure best practices in a collaborative environment
an accomplished data engineer able to work with large scale datasets requiring distributed processing
familiar with working with various types of data and have a problem-solving mindset
knowledgeable about machine learning and have experience with data engineering in a ML context
comfortable working in a large global team

Ideally you also:
Have experience with machine learning over knowledge graphs
Have experience with visualization and exploration of large graphs
Have experience with NLP, especially entity linking

Technologies: Databases
Spark
Graph Databases
Java, Python
RDF, SPARQL

Primary Location: US-New York
Job: Information Technology
Organization: Corporate
Schedule: Full-time
Employee Status: Regular
Job Level: Non-Management
Job Posting: May 4, 2020, 10:41:15 AM"
Software Developer,"Secaucus, NJ 07094",The Children's Place,None,"Job Summary:

Responsibilities:
Software Developer (Secaucus, NJ) –Design and develop online architecture solution for retail domain search platform using J2EE/shell Scripting, Solr, Lucidworks Fusion, Core Java, and Ecommerce systems architecture; Design and architect online search products and performance management, including Memory, Storage, Network, Cloud infrastructure, Web Service, Spark, Scala; Design and analyze data, search software applications, databases and information retrieval systems; Develop and test behavioral data analysis using SnowPlow Analytics, NLP.
Must have a Master’s Degree in Computer Science, Computer Engineering, or Information Technology plus 2 years experience in job offered. Require skills and knowledge of J2EE/Shell Scripting, Solr, Lucidworks Fusion, Core Java, Ecommerce systems architecture, Web Service.
Location: Secaucus, NJ. This position is eligible for Employee Referral Program. Submit résumé referencing job code SRC003 to HR, The Children’s Place Services Company, 500 Plaza Drive, Secaucus, NJ 07094."
Artificial Intelligence Engineer (NYC),"New York, NY",IBKR,None,"Job Description and Responsibilities
We're growing our team - if you're a high-energy, self-starting engineer with hands on experience with Artificial Intelligence, Interactive Brokers is the place for you. We take pride in providing our global client base with cutting-edge trading applications.

Interactive Brokers was founded by a software engineer to rewrite the rules of trading by automating anything and everything. Software development is the lifeblood of our firm, and it shows. Our engineers work with latest technology, command respect in the firm, and have competitive compensation packages.
Develop solutions for real-world, large-scale problems using Artificial Intelligence/Machine Learning; improve deep learning engine that services our brokerage clients: https://ibkr.com/bot
This role bridges the gap between Software Engineer and Research Scientist.
Add more skills to the neural network, define training and validation sets; code automated tests.
Setup feedback learning loop and fine-tune behavior based on customer interactions.
Formulate and run experiments to improve comprehension rate by altering topology, tweaking activation and learning function and alike.
Assist in coding execution engine.
We use Deeplearning4j framework.
Qualifications
At least Bachelor degree (MS or PhD preferred) in Computer Science, Artificial Intelligence, Machine Learning, or related technical field.
Working experience with any major deep learning engine; familiarity with Deep Learning for Java (DL4J) toolkit is a major plus.
Hands on Java coding experience is required; we use Java language for AI models in production and we'd like you to be able to contribute effectively in this setup
Ideal candidate will be skilled in natural language processing, predictive and classification algos.
Technically oriented, proactive, and enthusiastic, with extreme attention to detail.
English written/verbal communication skills.
**This is not a position for which non-US work visa sponsorship will be provided.
Company Overview

Interactive Brokers (""IBKR""), a subsidiary of publicly-traded Interactive Brokers Group, Inc., based in Greenwich, Connecticut (NASDAQ: IBKR) is a low-cost provider of trade execution and clearing services for active traders, institutional investors, financial advisors and introducing brokers. IBKR's premier technology provides electronic access to stocks, options, futures, forex, bonds, and funds worldwide from a single IBKR Integrated Investment account. IBKR is one of the largest online brokers by trade volume and is consistently ranked at the top of its field.
Our employees are part of a dynamic, multinational, fast-paced, results-oriented team working to provide our customers with state-of-the-art trading technology, superior execution capabilities, worldwide electronic access, and sophisticated risk management tools.
Our headquarters are in Greenwich, CT, USA. IBKR has offices in the United States, Canada, the United Kingdom, Switzerland, Hungary, Estonia, Russia, India, Hong Kong, China, Japan and Australia.
IBKR is a member of NYSE, FINRA, and SIPC. Interactive Brokers Group brokerage affiliates are regulated by securities and commodities agencies around the world.
Click HERE to view a short video with a few words from current Interactive Brokers employees.
For more information, please visit www.ibkr.com/info"
Programmer/Data Scientist (Researcher),"New York, NY 10012 (Greenwich Village area)",New York University,None,"New York University: NYU - Domestic: Faculty of Arts and Science (FAS): Politics Department
Location
New York, NY
Open Date
Jun 5, 2020
Description
The NYU Center for Social Media and Politics supports research on (i) how social media impacts politics, with particular emphasis on the flow of information (and misinformation) on social media; (ii) innovative ways to use social media data to study politics; and (iii) developing open-source tools that facilitate the use of social media data for the study of politics. We are looking for a full-time software engineer to help build software and tools for collecting, processing, analyzing, and understanding large social media data sets. You will use modern programming tools to manage multi-terabyte databases, build data collection and analysis pipelines, and produce meaningful data visualizations. We require candidates to have either experience programming in relevant environments OR a degree in CS. Significant skills working with Python and SQL/NoSQL databases are mandatory. Experience working with semi-structured data, Spark/Hadoop/EMR, Lucene/ElasticSearch, REST APIs, machine learning toolkits like scikit-learn, and linux/unix systems are also highly valued. Interest in politics or social science combined with these programming skills is a plus.
You will work across SMaPP’s diverse portfolio of projects including: analyzing the behavior of bots in elections and the spread of disinformation through social media platforms, working with survey data merged with respondents’ social media behavior, analyzing Facebook data made available through the Social Science One program, identifying which users are most influential in online networks, examining the impact of YouTube and other sites on news consumption of individuals, and studying how and what individuals learn from social media during the 2020 U.S. election campaign. CSMaP is committed to the highest standards of data security and user privacy, and we never release data about individual users. Your role will help us maintain that standard across all of our research endeavors.
This is initially a one year position, with the possibility of it being converted into a longer-term role.
You will be given the opportunity to participate fully in the research environment, including authoring papers and open source software, attending conferences and seminars, and working closely with a broad group of researchers associated with the center.
CSMaP consists of three core faculty directors covering fields of Political Science, Computer Science, and Computational Biology, as well as software engineers, data scientists, PhD students in both Political Science and Data Science, affiliated faculty at NYU and other institutions, and undergraduates. The lab maintains a broad research agenda with many projects moving forward simultaneously. Recent publications and/or working papers have centered on the consumption of fake news, the distribution of media consumption by individuals, the links shared by IRA Troll accounts in the 2016 US election, how (competitive) authoritarian regimes respond to online opposition, and the prevalence of hate speech on Twitter.
Qualifications
Required education: An undergraduate degree in computer science.
Required experience: Significant knowledge of and experience with programming in Python.
Preferred education: Master’s in computer science, data science, or an analytical social science.
Preferred experience: 1+ years programming in a relevant environment, either in research or industry; experience working with semi-structured data, Spark/Hadoop/EMR, Lucene/ElasticSearch, REST APIs, machine learning toolkits, and linux/unix systems; experience with natural language processing, machine learning models, and network analysis is a plus."
SVP -- Surveillance Data Scientist,"Jersey City, NJ 07310 (The Waterfront area)",CITI,None,"Serves as a senior compliance risk officer for Independent Compliance Risk Management (ICRM)’s Surveillance Model Design and Implementation Team responsible for the design, implementation, and oversight for a suite of surveillances designed to detect behaviors that may violate regulatory rules or internal policies and procedures. When potentially anomalous behavior is detected, the team is responsible for working collaboratively with partners across the first and second lines of defense to determine the appropriate resolution of the matter, which may include employee discipline. The ICRM Global Surveillance platform encompasses a number of surveillance related portfolios including trade surveillance, e-communications and voice surveillance, employee trading, outside activities surveillance, and information barrier surveillance.
Key Activities include:
Creating, enhancing and implementing surveillance scenarios and conducting surveillance reviews. Improving surveillance tools and applications by coordinating with Information Technology on the timely implementation of enhancements and proactively addressing potential issues.
Participating in ad-hoc requests, special projects and regulatory exams directed by other organizations within the compliance or legal departments.
Other responsibilities include: overseeing the monitoring to adherence to ICRM’s Risk Policies and relevant procedures; preparing, editing and maintaining Compliance program related materials; interacting and working with other areas within Citi, as necessary; and keeping abreast of regulatory changes, new regulations and internal policy changes in order to further identify new key risk areas.
Interacting with global counterparts in regards to the governance of their surveillance portfolio.
Additional duties as assigned.
Qualifications:
Five to eight years of experience in data science, machine learning, quantitative research, quantitative analysis, advanced statistical methods, surveillance design, and/or data modeling required
Experience designing and prototyping surveillance patterns using time series analysis, features engineering, random forest, natural language processing, and/or advanced statistical methods highly desirable;
Prior experience managing and delivering surveillance projects highly desirable
Expertise of Compliance laws, rules, regulations, risks and typologies
Strong skills in organizing workflow, ideas and materials
Experience with drafting Business Requirement Documentation (BRD)
Excellent written, verbal and analytical skills
Must be a self-starter, flexible, innovative and adaptive
Highly motivated, strong attention to detail, team oriented, organized
Strong presentation skills with the ability to articulate complex problems and solutions through concise and clear messaging
Ability to work collaboratively with regional and global partners in other functional units; ability to navigate a complex organization; to influence and lead people across cultures at a senior level
Experience in managing regulatory exams and relationships with examiners, auditors, etc.
Awareness of regulatory requirements including local and US laws, international and industry standards
Education
Bachelor’s degree in business, finance, and/or engineering experience in data science, quantitative research/analysis, advanced statistical methods, and/or data modeling; experience and/or designing communications surveillance and/or trade surveillance; experience in a surveillance function (or similar) within compliance, or other control-related function in the financial services firm, regulatory organization consulting firm, or a combination thereof;
-
Grade :All Job Level - All Job FunctionsAll Job Level - All Job Functions - US
-
Time Type :Full time
-
Citi is an equal opportunity and affirmative action employer.
Minority/Female/Veteran/Individuals with Disabilities/Sexual Orientation/Gender Identity.
Citigroup Inc. and its subsidiaries (""Citi”) invite all qualified interested applicants to apply for career opportunities. If you are a person with a disability and need a reasonable accommodation to use our search tools and/or apply for a career opportunity .
To view the ""EEO is the Law"" poster . To view the EEO is the Law Supplement .
To view the EEO Policy Statement .
To view the Pay Transparency Posting ."
Senior Data Scientist,"New York, NY",Pivotal Software,None,"About Us VIDEO
Founded in 2013, Pivotal Software, Inc. combines our leading cloud-native platform, tools, and methodology to empower the world's largest organizations to adapt to change and build great software. Our technology unleashes developer productivity, while fulfilling our mission to transform how the world builds software.
You
As a data scientist on Pivotal's Data Science team, you'll be working on a wide variety of data problems for a diverse range of clients. You will often be asked to learn new technologies and domains on the fly. You should be comfortable working under deadlines and making tough decisions. Consequently, you will frequently have to balance achieving an immediate goal with scalability and productionalizability.
The role offers room for personal and professional growth, and you won't be working in isolation. Data Science at Pivotal is an encouraging and supportive team, where ideas and challenges are addressed collaboratively. We're looking for the kind of person who will try and solve a problem on their own first, but isn't afraid to ask for help or say ""I don't know.""
Us
The Data Science team at Pivotal is primarily a consulting practice; we are tool agnostic, working with our customers to solve real world problems. Our customers, like us, are cross-disciplinary. We service engagements with use cases running from customer churn to optimization to detecting fraud and misconduct. We are not just doers, we are also educators and enablers.
Your Day
While there is no such thing as a ""typical day"", these are activities we frequently find ourselves doing:
Working with clients to uncover and frame new opportunities for data science. Clients often come to us without a clear understanding of what we can do, so this is our chance to open their eyes to new possibilities for their businesses.
Exploring client datasets, looking for actionable insights we can present.
Engineering features, training models, tuning hyperparameters and evaluating the results. We emphasize rigor, because data science done right at this stage leads to models that shine in production.
Taking the models we build into production. This is an exciting stage for anyone who likes collaborating with engineering teams and seeing their model become real when users interact with it.
Helping our clients develop their internal data science practices, from hiring and recruiting to data capturing, so that they can be successful when we hand off the project.
Required Skills / Experiences
Clear and empathetic communicator. You'll be the one sharing your insights with clients and stakeholders at check-ins, documenting your work, and even explaining your model to client data teams as part of a handoff. As such, communication and empathy are essential parts of your toolkit.
Advanced knowledge of statistical modeling and/or machine learning methods. These are the tools we need to go from analysis to prediction.
Strong programming skills. Left to our own devices most of us work in Python, but learning the client's tech stack is an important part of the job.
Strong exploratory data analysis skills. Every engagement starts with an investigation of the data, and thorough EDA saves us a lot of headaches in the long run.
Some travel is expected, depending on location and skillset. We mostly work out of the Pivotal office closest to the client, but sometimes we have to be on site for an extended period of time.
At least a bachelor's degree in an analytical or technical field. This could be applied mathematics, statistics, computer science, operations research, economics, etc. Higher education welcome and encouraged.
This role will support US government clients that require US citizenship. Given this, US citizenship is required for you to apply.
Desired Skills / Experiences
2+ years of work in a data-centric field (data science or data engineering).
Experience with relational databases.
Exposure and experience working in a Linux environment.
You have a specialization in an area like NLP, optimization, or image processing.
Hands-on experience working in a distributed computing environment or proven theoretical understanding of parallelism.
Pivotal is an Equal Employment Opportunity employer that will consider all qualified applicants, regardless of race, color, religion, gender, sexual orientation, marital status, gender identity or expression, national origin, genetics, age, disability status, protected veteran status, or any other characteristic protected by applicable law."
